{
  "schema_version": "0.1",
  "task_id": "task-medium-weak-001",
  "review_type": "quality",
  "verdict": "approved",
  "findings": [
    "quality checks passed, but verification evidence remains intentionally light in this fixture"
  ],
  "approved_by": "quality-reviewer",
  "next_action": "finalize 가능, 다만 실제 운영에서는 quality scrutiny 필요",
  "evidence_refs": [],
  "blockers": []
}
