{
  "schema_version": "0.1",
  "task_id": "task-large-unsafe-001",
  "review_type": "spec",
  "verdict": "approved",
  "findings": [
    "spec review passed, but rollout sequencing remains sensitive"
  ],
  "approved_by": "spec-reviewer",
  "next_action": "quality-review로 진행",
  "evidence_refs": [],
  "blockers": []
}
